{
  "metadata": {
    "name": "Warm Pad Init",
    "author": "Ed",
    "description": "A simple evolving pad to validate the synth engine.",
    "tags": ["pad", "warm", "init"],
    "createdAt": "2026-03-05T14:46:00Z",
    "updatedAt": "2026-03-05T14:46:00Z"
  },

  "engine": {
    "polyphony": 8,
    "tuning": 440,
    "glide": 0,
    "legato": false,
    "macros": []
  },

  "modules": [
    {
      "id": "osc1",
      "type": "oscillator",
      "signal": "audio",
      "parameters": {
        "waveform": "saw",
        "pitch": 0,
        "detune": -4,
        "phase": 0,
        "level": 0.7
      }
    },
    {
      "id": "osc2",
      "type": "oscillator",
      "signal": "audio",
      "parameters": {
        "waveform": "saw",
        "pitch": 0,
        "detune": 4,
        "phase": 0,
        "level": 0.7
      }
    },
    {
      "id": "filter1",
      "type": "filter",
      "signal": "audio",
      "parameters": {
        "filterType": "lowpass",
        "cutoff": 800,
        "resonance": 0.2,
        "drive": 0.1,
        "mix": 1.0
      }
    },
    {
      "id": "env1",
      "type": "envelope",
      "signal": "mod",
      "parameters": {
        "attack": 0.5,
        "decay": 1.0,
        "sustain": 0.8,
        "release": 1.5
      }
    },
    {
      "id": "lfo1",
      "type": "lfo",
      "signal": "mod",
      "parameters": {
        "shape": "triangle",
        "rate": 0.3,
        "sync": false,
        "phase": 0,
        "amount": 0.4
      }
    },
    {
      "id": "delay1",
      "type": "delay",
      "signal": "audio",
      "parameters": {
        "time": 0.35,
        "feedback": 0.3,
        "damping": 0.2,
        "mix": 0.25
      }
    },
    {
      "id": "reverb1",
      "type": "reverb",
      "signal": "audio",
      "parameters": {
        "reverbType": "hall",
        "size": 0.8,
        "decay": 2.5,
        "damping": 0.3,
        "mix": 0.35
      }
    }
  ],

  "audioRouting": [
    { "from": "osc1", "to": "filter1" },
    { "from": "osc2", "to": "filter1" },
    { "from": "filter1", "to": "delay1" },
    { "from": "delay1", "to": "reverb1" },
    { "from": "reverb1", "to": "output" }
  ],

  "modRouting": [
    { "from": "env1", "to": "osc1.level", "amount": 0.3 },
    { "from": "env1", "to": "osc2.level", "amount": 0.3 },
    { "from": "lfo1", "to": "filter1.cutoff", "amount": 200 }
  ],

  "ui": {
    "selectedTab": "main",
    "expandedModules": ["osc1", "osc2", "filter1"],
    "collapsedClusters": []
  },

  "userData": {}
}
